[
  {
    "id": "claim-annual-membership",
    "importance": "core",
    "text": {
      "en": "GPT-NeoX-20B is row 50 of the BenchCouncil AI100 (2022-2023) annual table in the LLM area.",
      "zh": "GPT-NeoX-20B 是 BenchCouncil AI100（2022-2023）年度表第 50 行，所属领域为“大语言模型”。"
    },
    "sourceIds": [
      "source-benchcouncil-annual"
    ],
    "status": "verified"
  },
  {
    "id": "claim-publication-record",
    "importance": "display",
    "text": {
      "en": "The annual table associates GPT-NeoX-20B with “GPT-NeoX-20B: An Open-Source Autoregressive Language Model”.",
      "zh": "年度表把 GPT-NeoX-20B 与论文《GPT-NeoX-20B: An Open-Source Autoregressive Language Model》关联。"
    },
    "sourceIds": [
      "source-primary-record",
      "source-benchcouncil-annual"
    ],
    "status": "verified"
  },
  {
    "id": "claim-contributor-record",
    "importance": "display",
    "text": {
      "en": "The Main Contributors field is “Sid Black, Stella Biderman, Eric Hallahan”.",
      "zh": "“主要人物”字段依次列出 Sid Black（官方页拼写）、Stella Biderman（官方页拼写）、Eric Hallahan（官方页拼写）；官方英文原文为“Sid Black, Stella Biderman, Eric Hallahan”。"
    },
    "sourceIds": [
      "source-benchcouncil-annual"
    ],
    "status": "verified"
  }
]
