[
  {
    "id": "claim-humanistic-1966-17-babel-17-core",
    "importance": "core",
    "text": {
      "zh": "通过一种具有速度与精确性的语言，讨论语言、认知、控制与心智编程；语言改变感知和行为。",
      "en": "通过一种具有速度与精确性的语言，讨论语言、认知、控制与心智编程；语言改变感知和行为。"
    },
    "sourceIds": [
      "source-humanistic-1966-17-babel-17-record"
    ],
    "status": "needs-review"
  }
]
