[
  {
    "id": "claim-annual-membership",
    "importance": "core",
    "text": {
      "en": "AlterNet is row 15 of the BenchCouncil AI100 (2022-2023) annual table in the Vision area.",
      "zh": "AlterNet 是 BenchCouncil AI100（2022-2023）年度表第 15 行，所属领域为“视觉”。"
    },
    "sourceIds": [
      "source-benchcouncil-annual"
    ],
    "status": "verified"
  },
  {
    "id": "claim-publication-record",
    "importance": "display",
    "text": {
      "en": "The annual table associates AlterNet with “How Do Vision Transformers Work?”.",
      "zh": "年度表把 AlterNet 与论文《How Do Vision Transformers Work?》关联。"
    },
    "sourceIds": [
      "source-primary-record",
      "source-benchcouncil-annual"
    ],
    "status": "verified"
  },
  {
    "id": "claim-contributor-record",
    "importance": "display",
    "text": {
      "en": "The Main Contributors field is “Namuk Park, Songkuk Kim”.",
      "zh": "“主要人物”字段依次列出 Namuk Park（官方页拼写）、Songkuk Kim（官方页拼写）；官方英文原文为“Namuk Park, Songkuk Kim”。"
    },
    "sourceIds": [
      "source-benchcouncil-annual"
    ],
    "status": "verified"
  }
]
