[
  {
    "id": "claim-annual-membership",
    "importance": "core",
    "text": {
      "en": "BEVFormer is row 12 of the BenchCouncil AI100 (2022-2023) annual table in the Vision area.",
      "zh": "BEVFormer 是 BenchCouncil AI100（2022-2023）年度表第 12 行，所属领域为“视觉”。"
    },
    "sourceIds": [
      "source-benchcouncil-annual"
    ],
    "status": "verified"
  },
  {
    "id": "claim-publication-record",
    "importance": "display",
    "text": {
      "en": "The annual table associates BEVFormer with “BEVFormer: Learning Bird's-Eye-View Representation from Multi-Camera Images via Spatiotemporal Transformers”.",
      "zh": "年度表把 BEVFormer 与论文《BEVFormer: Learning Bird's-Eye-View Representation from Multi-Camera Images via Spatiotemporal Transformers》关联。"
    },
    "sourceIds": [
      "source-primary-record",
      "source-benchcouncil-annual"
    ],
    "status": "verified"
  },
  {
    "id": "claim-contributor-record",
    "importance": "display",
    "text": {
      "en": "The Main Contributors field is “Zhiqi Li, Wenhai Wang, Hongyang Li, Jifeng Dai”.",
      "zh": "“主要人物”字段依次列出 Zhiqi Li（官方页拼写）、Wenhai Wang（官方页拼写）、Hongyang Li（官方页拼写）、Jifeng Dai（官方页拼写）；官方英文原文为“Zhiqi Li, Wenhai Wang, Hongyang Li, Jifeng Dai”。"
    },
    "sourceIds": [
      "source-benchcouncil-annual"
    ],
    "status": "verified"
  }
]
