[
  {
    "id": "claim-1997-adaboost-membership",
    "importance": "core",
    "text": {
      "en": "AdaBoost is listed in the BenchCouncil long-term AI100 table.",
      "zh": "AdaBoost 自适应提升列入 BenchCouncil 长期 AI100 主表。"
    },
    "sourceIds": [
      "source-benchcouncil-ai100-catalog"
    ],
    "status": "verified"
  },
  {
    "id": "claim-1997-adaboost-description",
    "importance": "core",
    "text": {
      "en": "<p>Early boosting theory established that weak learners could be strengthened, but practical algorithms needed a simple way to choose and weight training examples. AdaBoost supplied an adaptive procedure driven by classification mistakes.</p><p>After each weak classifier, AdaBoost increases the weights of misclassified examples and decreases the weights of correctly classified ones. The final prediction is a weighted vote whose coefficients depend on each learner’s accuracy. Experts generally regard AdaBoost as the algorithm that made boosting practical and conceptually transparent. It shaped margin theory, cascade detectors, and later additive-model views of ensemble learning.</p>",
      "zh": "<p>早期 Boosting 理论证明弱学习器可以被增强，但实用算法还需要一种简单方法选择并加权训练样本。AdaBoost 提供了由分类错误驱动的自适应过程。</p><p>每训练一个弱分类器后，AdaBoost 提高误分类样本权重，降低正确分类样本权重。最终预测是加权投票，各学习器系数取决于其准确性。专家通常把 AdaBoost 视为使 Boosting 走向实用且概念清晰的关键算法。它影响了间隔理论、级联检测器以及后来对集成学习的加性模型解释。</p>"
    },
    "sourceIds": [
      "source-1997-adaboost-primary",
      "source-1997-adaboost-secondary",
      "source-benchcouncil-ai100-catalog"
    ],
    "status": "verified"
  }
]
