[
  {
    "id": "claim-1996-bagging-membership",
    "importance": "core",
    "text": {
      "en": "Bagging is listed in the BenchCouncil long-term AI100 table.",
      "zh": "Bagging 装袋法列入 BenchCouncil 长期 AI100 主表。"
    },
    "sourceIds": [
      "source-benchcouncil-ai100-catalog"
    ],
    "status": "verified"
  },
  {
    "id": "claim-1996-bagging-description",
    "importance": "core",
    "text": {
      "en": "<p>High-variance learners such as deep decision trees could change sharply when the training sample changed slightly. Bagging proposed using resampling and aggregation to turn that instability into an advantage.</p><p>Multiple bootstrap samples are drawn from the training set, one predictor is fitted to each sample, and their outputs are averaged or voted. Aggregation reduces variance while preserving the strength of the base learner. Experts generally treat bagging as a foundational ensemble method and the conceptual base of random forests. Bootstrap aggregation remains a standard strategy for uncertainty reduction and robust prediction.</p>",
      "zh": "<p>深决策树等高方差学习器会因训练样本的轻微变化而产生显著不同的模型。Bagging 提出通过重采样与聚合，把这种不稳定性转化为优势。</p><p>从训练集抽取多个自助样本，为每个样本训练一个预测器，再对输出进行平均或投票。聚合在保留基学习器能力的同时降低方差。专家通常把 Bagging 视为基础集成方法，也是随机森林的概念基础。自助聚合至今仍是降低不确定性和提升预测稳健性的标准策略。</p>"
    },
    "sourceIds": [
      "source-1996-bagging-primary",
      "source-1996-bagging-secondary",
      "source-benchcouncil-ai100-catalog"
    ],
    "status": "verified"
  }
]
